{
  "schemaVersion": "1.0",
  "source": {
    "reportId": "report-0000000000000001",
    "reportFingerprint": "0000000000000000000000000000000000000000000000000000000000000000",
    "base": null,
    "head": null
  },
  "state": {
    "schemaVersion": "1.3",
    "reportId": "report-0000000000000001",
    "reportFingerprint": "0000000000000000000000000000000000000000000000000000000000000000",
    "revision": 0,
    "updatedAt": "2026-08-07T00:00:00.000Z",
    "viewed": {},
    "judgments": {},
    "threadIds": [],
    "orphanedThreadIds": []
  },
  "threads": [],
  "events": [],
  "anchorCatalog": [],
  "exportedAt": "2026-08-07T00:00:00.000Z"
}
